{
  "version": 1,
  "guideline_id": "gui_dCquvqE1csI3",
  "title": "Ensure that integer operations do not result in arithmetic overflow",
  "source_path": "src/coding-guidelines/expressions/gui_dCquvqE1csI3.rst",
  "source_sha": "1c7d6bb9448a25401db3b411d1783cd4e78fc718",
  "tier": "strict",
  "metadata": {
    "id": "gui_dCquvqE1csI3",
    "category": "required",
    "status": "draft",
    "release": "1.0 - latest",
    "fls": "fls_oFIRXBPXu6Zv",
    "decidability": "decidable",
    "scope": "system",
    "tags": [
      "security",
      "performance",
      "numerics"
    ]
  },
  "rule_text": "Eliminate arithmetic overflow [cite:gui_dCquvqE1csI3:FLS-ARITHMETIC-OVERFLOW] of both signed and unsigned integer types.\nAny wraparound behavior must be explicitly specified to ensure the same behavior in both debug and release modes.\n\nThis rule applies to the following primitive types:\n\n* `i8`\n* `i16`\n* `i32`\n* `i64`\n* `i128`\n* `u8`\n* `u16`\n* `u32`\n* `u64`\n* `u128`\n* `usize`\n* `isize`",
  "rationale_text": "Eliminate arithmetic overflow to avoid runtime panics and unexpected wraparound behavior.\nArithmetic overflow will panic in debug mode, but wraparound in release mode, resulting in inconsistent behavior.\nUse explicit `std::num::Wrapping` or\n`std::num::Saturating` semantics where these behaviors are intentional.\nRange checking can be used to eliminate the possibility of arithmetic overflow.",
  "non_compliant_examples": [
    {
      "example_id": "non_compl_ex_cCh2RQUXeH0N",
      "status": "",
      "description": "This noncompliant code example can result in arithmetic overflow during the addition of the signed operands `si_a` and `si_b`:",
      "rust_code": "#[allow(dead_code)]\nfn add(si_a: i32, si_b: i32) {\n  let _sum: i32 = si_a + si_b;\n  // ...\n}\n#\n# fn main() {}",
      "options": {}
    },
    {
      "example_id": "non_compl_ex_cCh2RQUXeH0O",
      "status": "",
      "description": "This noncompliant code example example prevents divide-by-zero errors, but does not prevent arithmetic overflow.",
      "rust_code": "# #[derive(Debug)]\n#[allow(dead_code)]\nenum DivError { DivisionByZero, Overflow }\n\n#[allow(dead_code)]\nfn div(s_a: i64, s_b: i64) -> Result<i64, DivError> {\n    if s_b == 0 {\n        Err(DivError::DivisionByZero)\n    } else {\n        Ok(s_a / s_b)\n    }\n}\n#\n# fn main() {}",
      "options": {}
    }
  ],
  "compliant_examples": [
    {
      "example_id": "compl_ex_BgUHiRB4kc4b_1",
      "status": "",
      "description": "This compliant solution ensures that the addition operation cannot result in arithmetic overflow,\nbased on the maximum range of a signed 32-bit integer.\nFunctions such as\n`u32::overflowing_add`,\n`u32::overflowing_sub`, and\n`u32::overflowing_mul`\ncan also be used to detect overflow.\nCode that invoked these functions would typically further restrict the range of possible values,\nbased on the anticipated range of the inputs.",
      "rust_code": "# #[derive(Debug)]\n#[allow(dead_code)]\nenum ArithmeticError { Overflow, DivisionByZero }\nuse std::i32::{MAX as INT_MAX, MIN as INT_MIN};\n\n#[allow(dead_code)]\nfn add(si_a: i32, si_b: i32) -> Result<i32, ArithmeticError> {\n    if (si_b > 0 && si_a > INT_MAX - si_b)\n        || (si_b < 0 && si_a < INT_MIN - si_b)\n    {\n        Err(ArithmeticError::Overflow)\n    } else {\n        Ok(si_a + si_b)\n    }\n}\n\n#[allow(dead_code)]\nfn sub(si_a: i32, si_b: i32) -> Result<i32, ArithmeticError> {\n    if (si_b < 0 && si_a > INT_MAX + si_b)\n        || (si_b > 0 && si_a < INT_MIN + si_b)\n    {\n        Err(ArithmeticError::Overflow)\n    } else {\n        Ok(si_a - si_b)\n    }\n}\n\n#[allow(dead_code)]\nfn mul(si_a: i32, si_b: i32) -> Result<i32, ArithmeticError> {\n    if si_a == 0 || si_b == 0 {\n        return Ok(0);\n    }\n\n    // Detect overflow before performing multiplication\n    if (si_a == -1 && si_b == INT_MIN) || (si_b == -1 && si_a == INT_MIN) {\n        Err(ArithmeticError::Overflow)\n    } else if (si_a > 0 && (si_b > INT_MAX / si_a || si_b < INT_MIN / si_a))\n        || (si_a < 0 && (si_b > INT_MIN / si_a || si_b < INT_MAX / si_a))\n    {\n        Err(ArithmeticError::Overflow)\n    } else {\n        Ok(si_a * si_b)\n    }\n}\n#\n# fn main() {}",
      "options": {}
    },
    {
      "example_id": "compl_ex_BgUHiRB4kc4c",
      "status": "",
      "description": "This compliant example uses safe checked addition instead of manual bounds checks.\nChecked functions can reduce readability when complex arithmetic expressions are needed.",
      "rust_code": "# #[derive(Debug)]\n#[allow(dead_code)]\nenum ArithmeticError { Overflow, DivisionByZero }\n\n#[allow(dead_code)]\nfn add(si_a: i32, si_b: i32) -> Result<i32, ArithmeticError> {\n    si_a.checked_add(si_b).ok_or(ArithmeticError::Overflow)\n}\n\n#[allow(dead_code)]\nfn sub(a: i32, b: i32) -> Result<i32, ArithmeticError> {\n    a.checked_sub(b).ok_or(ArithmeticError::Overflow)\n}\n\n#[allow(dead_code)]\nfn mul(a: i32, b: i32) -> Result<i32, ArithmeticError> {\n    a.checked_mul(b).ok_or(ArithmeticError::Overflow)\n}\n#\n# fn main() {}",
      "options": {}
    },
    {
      "example_id": "compl_ex_BgUHiRB4kc4b",
      "status": "",
      "description": "Wrapping behavior must be explicitly requested. This compliant example uses wrapping functions.",
      "rust_code": "#[allow(dead_code)]\nfn add(a: i32, b: i32) -> i32 {\n    a.wrapping_add(b)\n}\n\n#[allow(dead_code)]\nfn sub(a: i32, b: i32) -> i32 {\n    a.wrapping_sub(b)\n}\n\n#[allow(dead_code)]\nfn mul(a: i32, b: i32) -> i32 {\n    a.wrapping_mul(b)\n}\n#\n# fn main() {}",
      "options": {}
    },
    {
      "example_id": "compl_ex_BhUHiRB4kc4b",
      "status": "",
      "description": "Wrapping behavior call also be achieved using the `std::num::Wrapping` type as in this compliant solution.\nThe `std::num::Wrapping` type is a `struct` found in the `core::num` module that explicitly enables two's complement\nwrapping arithmetic for the inner type `T` (which must be an integer or `usize/isize`).\nThe `std::num::Wrapping` type provides a consistent way to force wrapping behavior in all build modes,\nwhich is useful in specific scenarios like implementing cryptography or hash functions where wrapping arithmetic is the intended behavior.",
      "rust_code": "use std::num::Wrapping;\n\nfn add(si_a: Wrapping<i32>, si_b: Wrapping<i32>) -> Wrapping<i32> {\n    si_a + si_b\n}\n\n#[allow(dead_code)]\nfn sub(si_a: Wrapping<i32>, si_b: Wrapping<i32>) -> Wrapping<i32> {\n    si_a - si_b\n}\n\n#[allow(dead_code)]\nfn mul(si_a: Wrapping<i32>, si_b: Wrapping<i32>) -> Wrapping<i32> {\n    si_a * si_b\n}\n\nfn main() {\n    let si_a = Wrapping(i32::MAX);\n    let si_b = Wrapping(i32::MAX);\n    println!(\"{} + {} = {}\", si_a, si_b, add(si_a, si_b))\n}",
      "options": {}
    },
    {
      "example_id": "compl_ex_BgUHiSB4kc4b",
      "status": "",
      "description": "Saturation semantics means that instead of wrapping around or resulting in an error,\nany result that falls outside the valid range of the integer type is clamped:\n\n- To the maximum value, if the result were to be greater than the maximum value, or\n- To the minimum value, if the result were to be smaller than the minimum,\n\nSaturation semantics always conform to this rule because they ensure that integer operations do not result in arithmetic overflow.\nThis compliant solution shows how to use saturating functions to provide saturation semantics for some basic arithmetic operations.",
      "rust_code": "#[allow(dead_code)]\nfn add(a: i32, b: i32) -> i32 {\n    a.saturating_add(b)\n}\n\n#[allow(dead_code)]\nfn sub(a: i32, b: i32) -> i32 {\n    a.saturating_sub(b)\n}\n\n#[allow(dead_code)]\nfn mul(a: i32, b: i32) -> i32 {\n    a.saturating_mul(b)\n}\n#\n# fn main() {}",
      "options": {}
    },
    {
      "example_id": "compl_ex_BgUHiSB4kd4b",
      "status": "",
      "description": "This compliant solution uses the `std::num::Saturating` type to define several functions that perform basic integer operations using saturation semantics.",
      "rust_code": "use std::num::Saturating;\n\nfn add(si_a: Saturating<i32>, si_b: Saturating<i32>) -> Saturating<i32> {\n    si_a + si_b\n}\n\n#[allow(dead_code)]\nfn sub(si_a: Saturating<i32>, si_b: Saturating<i32>) -> Saturating<i32> {\n    si_a - si_b\n}\n\n#[allow(dead_code)]\nfn mul(si_a: Saturating<i32>, si_b: Saturating<i32>) -> Saturating<i32> {\n    si_a * si_b\n}\n\nfn main() {\n    let si_a = Saturating(i32::MAX);\n    let si_b = Saturating(i32::MAX);\n    println!(\"{} + {} = {}\", si_a, si_b, add(si_a, si_b))\n}",
      "options": {}
    },
    {
      "example_id": "compl_ex_BgUHiRB4kc4d",
      "status": "",
      "description": "This compliant solution eliminates the possibility of both divide-by-zero errors and arithmetic overflow:",
      "rust_code": "# #[derive(Debug)]\n#[allow(dead_code)]\nenum DivError { DivisionByZero, Overflow }\n\n#[allow(dead_code)]\nfn div(s_a: i64, s_b: i64) -> Result<i64, DivError> {\n    if s_b == 0 {\n        Err(DivError::DivisionByZero)\n    } else if s_a == i64::MIN && s_b == -1 {\n        Err(DivError::Overflow)\n    } else {\n        Ok(s_a / s_b)\n    }\n}\n#\n# fn main() {}",
      "options": {}
    }
  ],
  "references": [
    {
      "key": "gui_dCquvqE1csI3:FLS-ARITHMETIC-OVERFLOW",
      "description": "The Rust FLS. \"Expressions - Arithmetic Overflow.\" https://rust-lang.github.io/fls/expressions.html#arithmetic-overflow"
    }
  ],
  "citations": [
    "gui_dCquvqE1csI3:FLS-ARITHMETIC-OVERFLOW"
  ],
  "std_refs": [
    "std::num::Saturating",
    "std::num::Wrapping",
    "u32::overflowing_add",
    "u32::overflowing_mul",
    "u32::overflowing_sub"
  ],
  "content_sha256": "c4deb69a7d3a7521236d91370716e728161d07ac21f858d26a63f0680d2ae915"
}
