{
  "version": 1,
  "guideline_id": "gui_ot2Zt3dd6of1",
  "title": "Recursive function are not allowed",
  "source_path": "src/coding-guidelines/associated-items/gui_ot2Zt3dd6of1.rst",
  "source_sha": "1c7d6bb9448a25401db3b411d1783cd4e78fc718",
  "tier": "strict",
  "metadata": {
    "id": "gui_ot2Zt3dd6of1",
    "category": "required",
    "status": "draft",
    "release": "1.3.0-latest",
    "fls": "fls_vjgkg8kfi93",
    "decidability": "undecidable",
    "scope": "system",
    "tags": [
      "stack-overflow"
    ]
  },
  "rule_text": "Any function shall not call itself directly or indirectly",
  "rationale_text": "Recursive functions can easily cause stack overflows, which may result in exceptions or, in some cases, undefined behavior (typically some embedded systems). Although the Rust compiler supports tail call optimization [cite:gui_ot2Zt3dd6of1:WIKI-TAIL-CALL], this optimization is not guaranteed and depends on the specific implementation and function structure. There is an open RFC to guarantee tail call optimization in the Rust compiler [cite:gui_ot2Zt3dd6of1:PROPOSED-RFC-EXPLICIT-TAIL-CALLS], but this feature has not yet been stabilized. Until tail call optimization is guaranteed and stabilized, developers should avoid using recursive functions to prevent potential stack overflows and ensure program reliability.",
  "non_compliant_examples": [
    {
      "example_id": "non_compl_ex_MxqhjfkStJJy",
      "status": "",
      "description": "The below function `concat_strings` is not complaint because it call itself and depending on depth of data provided as input it could generate an stack overflow exception or undefine behavior.",
      "rust_code": "// Recursive enum to represent a string or a list of `MyEnum`\n#[allow(dead_code)]\nenum MyEnum {\n    Str(String),\n    List(Vec<MyEnum>),\n}\n\n// Concatenates strings from a nested structure of `MyEnum` using recursion.\n#[allow(dead_code)]\nfn concat_strings(input: &[MyEnum]) -> String {\n    let mut result = String::new();\n    for item in input {\n        match item {\n            MyEnum::Str(s) => result.push_str(s),\n            MyEnum::List(list) => result.push_str(&concat_strings(list)),\n        }\n    }\n    result\n}\n#\n# fn main() {}",
      "options": {}
    }
  ],
  "compliant_examples": [
    {
      "example_id": "compl_ex_9pK3h65rfceO",
      "status": "",
      "description": "The following code implements the same functionality using iteration instead of recursion. The `stack` variable is used to maintain the processing context at each step of the loop. This approach provides explicit control over memory usage. If the stack grows beyond a predefined limit due to the structure or size of the input, the function returns an error rather than risking a stack overflow or out-of-memory exception. This ensures more predictable and robust behavior in resource-constrained environments.",
      "rust_code": "// Recursive enum to represent a string or a list of `MyEnum`\n#[allow(dead_code)]\nenum MyEnum {\n    Str(String),\n    List(Vec<MyEnum>),\n}\n\n/// Concatenates strings from a nested structure of `MyEnum` without using recursion.\n/// Returns an error if the stack size exceeds `MAX_STACK_SIZE`.\n#[allow(dead_code)]\nfn concat_strings_non_recursive(input: &[MyEnum]) -> Result<String, &'static str> {\n    const MAX_STACK_SIZE: usize = 1000;\n    let mut result = String::new();\n    let mut stack = Vec::new();\n\n    // Add all items to the stack\n    stack.extend(input.iter());\n\n    while let Some(item) = stack.pop() {\n        match item {\n            MyEnum::Str(s) => result.insert_str(0, s),\n            MyEnum::List(list) => {\n                // Add list items to the stack\n                for sub_item in list.iter() {\n                    stack.push(sub_item);\n                    if stack.len() > MAX_STACK_SIZE {\n                        return Err(\"Too big structure\");\n                    }\n                }\n            }\n        }\n    }\n    Ok(result)\n}\n#\n# fn main() {}",
      "options": {}
    }
  ],
  "references": [
    {
      "key": "gui_ot2Zt3dd6of1:WIKI-TAIL-CALL",
      "description": "Wikipedia. \"Tail call.\" https://en.wikipedia.org/wiki/Tail_call"
    },
    {
      "key": "gui_ot2Zt3dd6of1:PROPOSED-RFC-EXPLICIT-TAIL-CALLS",
      "description": "Philipp G\u00f6rz. \"Open RFC - explicit_tail_calls.\" https://github.com/phi-go/rfcs/blob/guaranteed-tco/text/0000-explicit-tail-calls.md"
    }
  ],
  "citations": [
    "gui_ot2Zt3dd6of1:PROPOSED-RFC-EXPLICIT-TAIL-CALLS",
    "gui_ot2Zt3dd6of1:WIKI-TAIL-CALL"
  ],
  "std_refs": [],
  "content_sha256": "96d9130c09c3c55b1e6c1274750578ba52a350f3267e4db446ebc5d516200a4c"
}
