{
  "version": 1,
  "guideline_id": "gui_7y0GAMmtMhch",
  "title": "Do not use an integer type as a divisor during integer division",
  "source_path": "src/coding-guidelines/expressions/gui_7y0GAMmtMhch.rst",
  "source_sha": "1c7d6bb9448a25401db3b411d1783cd4e78fc718",
  "tier": "strict",
  "metadata": {
    "id": "gui_7y0GAMmtMhch",
    "category": "advisory",
    "status": "draft",
    "release": "latest",
    "fls": "fls_Q9dhNiICGIfr",
    "decidability": "decidable",
    "scope": "module",
    "tags": [
      "numerics",
      "subset"
    ]
  },
  "rule_text": "Do not provide a right operand of integer type [cite:gui_7y0GAMmtMhch:FLS-INTEGER-TYPES]\nduring a division expression [cite:gui_7y0GAMmtMhch:FLS-DIVISION-EXPR] or remainder expression [cite:gui_7y0GAMmtMhch:FLS-REMAINDER-EXPR] when the left operand also has integer type.\n\n This rule applies to the following primitive integer types:\n\n * `i8`\n * `i16`\n * `i32`\n * `i64`\n * `i128`\n * `u8`\n * `u16`\n * `u32`\n * `u64`\n * `u128`\n * `usize`\n * `isize`",
  "rationale_text": "Integer division and integer remainder division both panic when the right operand has a value of zero.\nDivision by zero is undefined in mathematics because it leads to contradictions and there is no consistent value that can be assigned as its result.",
  "non_compliant_examples": [
    {
      "example_id": "non_compl_ex_0XeioBrgfh5z",
      "status": "",
      "description": "Both the division and remainder operations in this non-compliant example will panic if evaluated because the right operand is zero.",
      "rust_code": "fn main() {\n    let x = 0;\n    let _y = 5 / x; // This line will panic.\n    let _z = 5 % x; // This line would also panic.\n}",
      "options": {
        "compile_fail": ""
      }
    }
  ],
  "compliant_examples": [
    {
      "example_id": "compl_ex_k1CD6xoZxhXb",
      "status": "",
      "description": "Checked division prevents division by zero from occurring.\nThe programmer can then handle the returned `std::option::Option`.\nUsing checked division and remainder is particularly important in the signed integer case,\nwhere arithmetic overflow can also occur when dividing the minimum representable value by -1.",
      "rust_code": "fn main() {\n    // Using the checked division API\n    let _y = match 5i32.checked_div(0) {\n        None => 0,\n        Some(r) => r,\n    };\n\n    // Using the checked remainder API\n    let _z = match 5i32.checked_rem(0) {\n        None => 0,\n        Some(r) => r,\n    };\n}",
      "options": {}
    },
    {
      "example_id": "compl_ex_k1CD6xoZxhXc",
      "status": "",
      "description": "This compliant solution creates a divisor using `std::num::NonZero`.\n`std::num::NonZero` is a wrapper around primitive integer types that guarantees the contained value is never zero.\n`std::num::NonZero::new` creates a new binding that represents a value that is known not to be zero.\nThis ensures that functions operating on its value can correctly assume that they are not being given zero as their input.\n\nNote that the test for arithmetic overflow that occurs when dividing the minimum representable value by -1 is unnecessary\nin this compliant example because the result of the division expression is an unsigned integer type.",
      "rust_code": "use std::num::NonZero;\n\nfn main() {\n    let x = 0u32;\n    if let Some(divisor) = NonZero::<u32>::new(x) {\n        let _result = 5u32 / divisor;\n    }\n}",
      "options": {
        "version": "1.79"
      }
    }
  ],
  "references": [
    {
      "key": "gui_7y0GAMmtMhch:FLS-INTEGER-TYPES",
      "description": "The Rust FLS. \"Types and Traits - Integer Types.\" https://rust-lang.github.io/fls/types-and-traits.html#integer-types"
    },
    {
      "key": "gui_7y0GAMmtMhch:FLS-DIVISION-EXPR",
      "description": "The Rust FLS. \"Expressions - Syntax - DivisionExpression.\" https://rust-lang.github.io/fls/expressions.html#syntax_divisionexpression"
    },
    {
      "key": "gui_7y0GAMmtMhch:FLS-REMAINDER-EXPR",
      "description": "The Rust FLS. \"Expressions - Syntax - RemainderExpression.\" https://rust-lang.github.io/fls/expressions.html#syntax_remainderexpression"
    }
  ],
  "citations": [
    "gui_7y0GAMmtMhch:FLS-DIVISION-EXPR",
    "gui_7y0GAMmtMhch:FLS-INTEGER-TYPES",
    "gui_7y0GAMmtMhch:FLS-REMAINDER-EXPR"
  ],
  "std_refs": [
    "std::num::NonZero",
    "std::num::NonZero::new",
    "std::option::Option"
  ],
  "content_sha256": "81f6f763ea22b19bd91e963d6a4e04b2646e418a2937918c1841dfa132389f74"
}
